{
  "schemaVersion": "control-scene/v1",
  "id": "scene/a0a3b6ef57a641663445d4481ad359e479d69ccfa5ebab6bec58f7bfd171339e",
  "dictionaryId": "dictionary/asset-corpus-v1",
  "dictionarySha256": "388428c5f06bf39628b1226aeef26eefe1f6f1615e5d53e6b9b9700c1c6ef2c1",
  "polygonOrderSha256": "663eacfe7217f6f624815460d032b67964e439ffadd103d47676825715bdc4b7",
  "geometrySha256": "67c7edcd504b2ee599d98e242a026b5146236e580c992b584980960fc931bf72",
  "instances": [
    {
      "id": "instance/a0a3b6ef57a641663445d4481ad359e479d69ccfa5ebab6bec58f7bfd171339e",
      "classId": 7
    },
    {
      "id": "instance/a0a3b6ef57a641663445d4481ad359e479d69ccfa5ebab6bec58f7bfd171339e/occluder",
      "classId": 7
    }
  ],
  "surfaces": [
    {
      "id": "instance/a0a3b6ef57a641663445d4481ad359e479d69ccfa5ebab6bec58f7bfd171339e/surface-0",
      "instanceId": "instance/a0a3b6ef57a641663445d4481ad359e479d69ccfa5ebab6bec58f7bfd171339e"
    },
    {
      "id": "instance/a0a3b6ef57a641663445d4481ad359e479d69ccfa5ebab6bec58f7bfd171339e/surface-1",
      "instanceId": "instance/a0a3b6ef57a641663445d4481ad359e479d69ccfa5ebab6bec58f7bfd171339e"
    },
    {
      "id": "instance/a0a3b6ef57a641663445d4481ad359e479d69ccfa5ebab6bec58f7bfd171339e/surface-2",
      "instanceId": "instance/a0a3b6ef57a641663445d4481ad359e479d69ccfa5ebab6bec58f7bfd171339e"
    },
    {
      "id": "instance/a0a3b6ef57a641663445d4481ad359e479d69ccfa5ebab6bec58f7bfd171339e/surface-3",
      "instanceId": "instance/a0a3b6ef57a641663445d4481ad359e479d69ccfa5ebab6bec58f7bfd171339e"
    },
    {
      "id": "instance/a0a3b6ef57a641663445d4481ad359e479d69ccfa5ebab6bec58f7bfd171339e/surface-4",
      "instanceId": "instance/a0a3b6ef57a641663445d4481ad359e479d69ccfa5ebab6bec58f7bfd171339e"
    },
    {
      "id": "instance/a0a3b6ef57a641663445d4481ad359e479d69ccfa5ebab6bec58f7bfd171339e/surface-5",
      "instanceId": "instance/a0a3b6ef57a641663445d4481ad359e479d69ccfa5ebab6bec58f7bfd171339e"
    },
    {
      "id": "instance/a0a3b6ef57a641663445d4481ad359e479d69ccfa5ebab6bec58f7bfd171339e/surface-6",
      "instanceId": "instance/a0a3b6ef57a641663445d4481ad359e479d69ccfa5ebab6bec58f7bfd171339e"
    },
    {
      "id": "instance/a0a3b6ef57a641663445d4481ad359e479d69ccfa5ebab6bec58f7bfd171339e/surface-7",
      "instanceId": "instance/a0a3b6ef57a641663445d4481ad359e479d69ccfa5ebab6bec58f7bfd171339e"
    },
    {
      "id": "instance/a0a3b6ef57a641663445d4481ad359e479d69ccfa5ebab6bec58f7bfd171339e/surface-8",
      "instanceId": "instance/a0a3b6ef57a641663445d4481ad359e479d69ccfa5ebab6bec58f7bfd171339e"
    },
    {
      "id": "instance/a0a3b6ef57a641663445d4481ad359e479d69ccfa5ebab6bec58f7bfd171339e/surface-9",
      "instanceId": "instance/a0a3b6ef57a641663445d4481ad359e479d69ccfa5ebab6bec58f7bfd171339e"
    },
    {
      "id": "instance/a0a3b6ef57a641663445d4481ad359e479d69ccfa5ebab6bec58f7bfd171339e/surface-10",
      "instanceId": "instance/a0a3b6ef57a641663445d4481ad359e479d69ccfa5ebab6bec58f7bfd171339e"
    },
    {
      "id": "instance/a0a3b6ef57a641663445d4481ad359e479d69ccfa5ebab6bec58f7bfd171339e/surface-11",
      "instanceId": "instance/a0a3b6ef57a641663445d4481ad359e479d69ccfa5ebab6bec58f7bfd171339e"
    },
    {
      "id": "instance/a0a3b6ef57a641663445d4481ad359e479d69ccfa5ebab6bec58f7bfd171339e/surface-12",
      "instanceId": "instance/a0a3b6ef57a641663445d4481ad359e479d69ccfa5ebab6bec58f7bfd171339e"
    },
    {
      "id": "instance/a0a3b6ef57a641663445d4481ad359e479d69ccfa5ebab6bec58f7bfd171339e/surface-13",
      "instanceId": "instance/a0a3b6ef57a641663445d4481ad359e479d69ccfa5ebab6bec58f7bfd171339e"
    },
    {
      "id": "instance/a0a3b6ef57a641663445d4481ad359e479d69ccfa5ebab6bec58f7bfd171339e/surface-14",
      "instanceId": "instance/a0a3b6ef57a641663445d4481ad359e479d69ccfa5ebab6bec58f7bfd171339e"
    },
    {
      "id": "instance/a0a3b6ef57a641663445d4481ad359e479d69ccfa5ebab6bec58f7bfd171339e/surface-15",
      "instanceId": "instance/a0a3b6ef57a641663445d4481ad359e479d69ccfa5ebab6bec58f7bfd171339e"
    },
    {
      "id": "instance/a0a3b6ef57a641663445d4481ad359e479d69ccfa5ebab6bec58f7bfd171339e/surface-16",
      "instanceId": "instance/a0a3b6ef57a641663445d4481ad359e479d69ccfa5ebab6bec58f7bfd171339e"
    },
    {
      "id": "instance/a0a3b6ef57a641663445d4481ad359e479d69ccfa5ebab6bec58f7bfd171339e/surface-17",
      "instanceId": "instance/a0a3b6ef57a641663445d4481ad359e479d69ccfa5ebab6bec58f7bfd171339e"
    },
    {
      "id": "instance/a0a3b6ef57a641663445d4481ad359e479d69ccfa5ebab6bec58f7bfd171339e/surface-18",
      "instanceId": "instance/a0a3b6ef57a641663445d4481ad359e479d69ccfa5ebab6bec58f7bfd171339e"
    },
    {
      "id": "instance/a0a3b6ef57a641663445d4481ad359e479d69ccfa5ebab6bec58f7bfd171339e/surface-19",
      "instanceId": "instance/a0a3b6ef57a641663445d4481ad359e479d69ccfa5ebab6bec58f7bfd171339e"
    },
    {
      "id": "instance/a0a3b6ef57a641663445d4481ad359e479d69ccfa5ebab6bec58f7bfd171339e/surface-20",
      "instanceId": "instance/a0a3b6ef57a641663445d4481ad359e479d69ccfa5ebab6bec58f7bfd171339e"
    },
    {
      "id": "instance/a0a3b6ef57a641663445d4481ad359e479d69ccfa5ebab6bec58f7bfd171339e/surface-21",
      "instanceId": "instance/a0a3b6ef57a641663445d4481ad359e479d69ccfa5ebab6bec58f7bfd171339e"
    },
    {
      "id": "instance/a0a3b6ef57a641663445d4481ad359e479d69ccfa5ebab6bec58f7bfd171339e/surface-22",
      "instanceId": "instance/a0a3b6ef57a641663445d4481ad359e479d69ccfa5ebab6bec58f7bfd171339e"
    },
    {
      "id": "instance/a0a3b6ef57a641663445d4481ad359e479d69ccfa5ebab6bec58f7bfd171339e/surface-23",
      "instanceId": "instance/a0a3b6ef57a641663445d4481ad359e479d69ccfa5ebab6bec58f7bfd171339e"
    },
    {
      "id": "instance/a0a3b6ef57a641663445d4481ad359e479d69ccfa5ebab6bec58f7bfd171339e/surface-24",
      "instanceId": "instance/a0a3b6ef57a641663445d4481ad359e479d69ccfa5ebab6bec58f7bfd171339e"
    },
    {
      "id": "instance/a0a3b6ef57a641663445d4481ad359e479d69ccfa5ebab6bec58f7bfd171339e/surface-25",
      "instanceId": "instance/a0a3b6ef57a641663445d4481ad359e479d69ccfa5ebab6bec58f7bfd171339e"
    },
    {
      "id": "instance/a0a3b6ef57a641663445d4481ad359e479d69ccfa5ebab6bec58f7bfd171339e/surface-26",
      "instanceId": "instance/a0a3b6ef57a641663445d4481ad359e479d69ccfa5ebab6bec58f7bfd171339e"
    },
    {
      "id": "instance/a0a3b6ef57a641663445d4481ad359e479d69ccfa5ebab6bec58f7bfd171339e/surface-27",
      "instanceId": "instance/a0a3b6ef57a641663445d4481ad359e479d69ccfa5ebab6bec58f7bfd171339e"
    },
    {
      "id": "instance/a0a3b6ef57a641663445d4481ad359e479d69ccfa5ebab6bec58f7bfd171339e/surface-28",
      "instanceId": "instance/a0a3b6ef57a641663445d4481ad359e479d69ccfa5ebab6bec58f7bfd171339e"
    },
    {
      "id": "instance/a0a3b6ef57a641663445d4481ad359e479d69ccfa5ebab6bec58f7bfd171339e/surface-29",
      "instanceId": "instance/a0a3b6ef57a641663445d4481ad359e479d69ccfa5ebab6bec58f7bfd171339e"
    },
    {
      "id": "instance/a0a3b6ef57a641663445d4481ad359e479d69ccfa5ebab6bec58f7bfd171339e/surface-30",
      "instanceId": "instance/a0a3b6ef57a641663445d4481ad359e479d69ccfa5ebab6bec58f7bfd171339e"
    },
    {
      "id": "instance/a0a3b6ef57a641663445d4481ad359e479d69ccfa5ebab6bec58f7bfd171339e/surface-31",
      "instanceId": "instance/a0a3b6ef57a641663445d4481ad359e479d69ccfa5ebab6bec58f7bfd171339e"
    },
    {
      "id": "instance/a0a3b6ef57a641663445d4481ad359e479d69ccfa5ebab6bec58f7bfd171339e/surface-32",
      "instanceId": "instance/a0a3b6ef57a641663445d4481ad359e479d69ccfa5ebab6bec58f7bfd171339e"
    },
    {
      "id": "instance/a0a3b6ef57a641663445d4481ad359e479d69ccfa5ebab6bec58f7bfd171339e/surface-33",
      "instanceId": "instance/a0a3b6ef57a641663445d4481ad359e479d69ccfa5ebab6bec58f7bfd171339e"
    },
    {
      "id": "instance/a0a3b6ef57a641663445d4481ad359e479d69ccfa5ebab6bec58f7bfd171339e/surface-34",
      "instanceId": "instance/a0a3b6ef57a641663445d4481ad359e479d69ccfa5ebab6bec58f7bfd171339e"
    },
    {
      "id": "instance/a0a3b6ef57a641663445d4481ad359e479d69ccfa5ebab6bec58f7bfd171339e/surface-35",
      "instanceId": "instance/a0a3b6ef57a641663445d4481ad359e479d69ccfa5ebab6bec58f7bfd171339e"
    },
    {
      "id": "instance/a0a3b6ef57a641663445d4481ad359e479d69ccfa5ebab6bec58f7bfd171339e/surface-36",
      "instanceId": "instance/a0a3b6ef57a641663445d4481ad359e479d69ccfa5ebab6bec58f7bfd171339e"
    },
    {
      "id": "instance/a0a3b6ef57a641663445d4481ad359e479d69ccfa5ebab6bec58f7bfd171339e/surface-37",
      "instanceId": "instance/a0a3b6ef57a641663445d4481ad359e479d69ccfa5ebab6bec58f7bfd171339e"
    },
    {
      "id": "instance/a0a3b6ef57a641663445d4481ad359e479d69ccfa5ebab6bec58f7bfd171339e/surface-38",
      "instanceId": "instance/a0a3b6ef57a641663445d4481ad359e479d69ccfa5ebab6bec58f7bfd171339e"
    },
    {
      "id": "instance/a0a3b6ef57a641663445d4481ad359e479d69ccfa5ebab6bec58f7bfd171339e/surface-39",
      "instanceId": "instance/a0a3b6ef57a641663445d4481ad359e479d69ccfa5ebab6bec58f7bfd171339e"
    },
    {
      "id": "instance/a0a3b6ef57a641663445d4481ad359e479d69ccfa5ebab6bec58f7bfd171339e/surface-40",
      "instanceId": "instance/a0a3b6ef57a641663445d4481ad359e479d69ccfa5ebab6bec58f7bfd171339e"
    },
    {
      "id": "instance/a0a3b6ef57a641663445d4481ad359e479d69ccfa5ebab6bec58f7bfd171339e/surface-41",
      "instanceId": "instance/a0a3b6ef57a641663445d4481ad359e479d69ccfa5ebab6bec58f7bfd171339e"
    },
    {
      "id": "instance/a0a3b6ef57a641663445d4481ad359e479d69ccfa5ebab6bec58f7bfd171339e/surface-42",
      "instanceId": "instance/a0a3b6ef57a641663445d4481ad359e479d69ccfa5ebab6bec58f7bfd171339e"
    },
    {
      "id": "instance/a0a3b6ef57a641663445d4481ad359e479d69ccfa5ebab6bec58f7bfd171339e/surface-43",
      "instanceId": "instance/a0a3b6ef57a641663445d4481ad359e479d69ccfa5ebab6bec58f7bfd171339e"
    },
    {